{
  "$id": "https://picyboo.dev/schemas/raw-metadata.json",
  "$schema": "https://json-schema.org/draft/2020-12/schema",
  "title": "Raw NFT Metadata",
  "type": "object",
  "required": ["name"],
  "properties": {
    "name": { "type": ["string", "null"] },
    "description": { "type": ["string", "null"] },
    "image": { "type": ["string", "null"] },
    "image_url": { "type": ["string", "null"] },
    "animation_url": { "type": ["string", "null"] },
    "external_url": { "type": ["string", "null"] },
    "attributes": {
      "oneOf": [
        {
          "type": "array"
        },
        {
          "type": "object"
        }
      ]
    }
  },
  "additionalProperties": true
}
